{
  "$schema": "./catalog-manifest.schema.json",
  "schemaVersion": 1,
  "catalogVersion": "2026.07.09",
  "name": "oh-my-forge",
  "description": "A comprehensive v2 ForgeCode (forge) workbench: 40 specialist agents, 46 skills, and 22 commands for multi-agent software engineering.",
  "agents": [
    {
      "id": "analyst",
      "path": "agents/analyst.md",
      "category": "core",
      "status": "active",
      "core": false,
      "reasoning": true
    },
    {
      "id": "api-designer",
      "path": "agents/api-designer.md",
      "category": "backend",
      "status": "active",
      "core": false,
      "reasoning": false
    },
    {
      "id": "architect",
      "path": "agents/architect.md",
      "category": "core",
      "status": "active",
      "core": true,
      "reasoning": true
    },
    {
      "id": "architect-low",
      "path": "agents/architect-low.md",
      "category": "core",
      "status": "active",
      "core": false,
      "reasoning": false
    },
    {
      "id": "auth-specialist",
      "path": "agents/auth-specialist.md",
      "category": "backend",
      "status": "active",
      "core": false,
      "reasoning": false
    },
    {
      "id": "code-reviewer",
      "path": "agents/code-reviewer.md",
      "category": "core",
      "status": "active",
      "core": true,
      "reasoning": true
    },
    {
      "id": "code-simplifier",
      "path": "agents/code-simplifier.md",
      "category": "specialist",
      "status": "active",
      "core": false,
      "reasoning": false
    },
    {
      "id": "critic",
      "path": "agents/critic.md",
      "category": "quality",
      "status": "active",
      "core": true,
      "reasoning": true
    },
    {
      "id": "data-modeler",
      "path": "agents/data-modeler.md",
      "category": "specialist",
      "status": "active",
      "core": false,
      "reasoning": false
    },
    {
      "id": "db-engineer",
      "path": "agents/db-engineer.md",
      "category": "backend",
      "status": "active",
      "core": false,
      "reasoning": false
    },
    {
      "id": "debugger",
      "path": "agents/debugger.md",
      "category": "core",
      "status": "active",
      "core": true,
      "reasoning": true
    },
    {
      "id": "dep-auditor",
      "path": "agents/dep-auditor.md",
      "category": "specialist",
      "status": "active",
      "core": false,
      "reasoning": false
    },
    {
      "id": "deploy-engineer",
      "path": "agents/deploy-engineer.md",
      "category": "backend",
      "status": "active",
      "core": false,
      "reasoning": false
    },
    {
      "id": "designer",
      "path": "agents/designer.md",
      "category": "frontend",
      "status": "active",
      "core": false,
      "reasoning": false
    },
    {
      "id": "designer-low",
      "path": "agents/designer-low.md",
      "category": "frontend",
      "status": "active",
      "core": false,
      "reasoning": false
    },
    {
      "id": "doc-writer",
      "path": "agents/doc-writer.md",
      "category": "specialist",
      "status": "active",
      "core": false,
      "reasoning": false
    },
    {
      "id": "document-specialist",
      "path": "agents/document-specialist.md",
      "category": "specialist",
      "status": "active",
      "core": false,
      "reasoning": false
    },
    {
      "id": "executor",
      "path": "agents/executor.md",
      "category": "core",
      "status": "active",
      "core": true,
      "reasoning": false
    },
    {
      "id": "executor-high",
      "path": "agents/executor-high.md",
      "category": "core",
      "status": "active",
      "core": false,
      "reasoning": true
    },
    {
      "id": "executor-low",
      "path": "agents/executor-low.md",
      "category": "core",
      "status": "active",
      "core": false,
      "reasoning": false
    },
    {
      "id": "explorer",
      "path": "agents/explorer.md",
      "category": "core",
      "status": "active",
      "core": false,
      "reasoning": false
    },
    {
      "id": "git-master",
      "path": "agents/git-master.md",
      "category": "specialist",
      "status": "active",
      "core": false,
      "reasoning": false
    },
    {
      "id": "git-strategist",
      "path": "agents/git-strategist.md",
      "category": "specialist",
      "status": "active",
      "core": false,
      "reasoning": false
    },
    {
      "id": "gnu-emacs",
      "path": "agents/gnu-emacs.md",
      "category": "specialist",
      "status": "active",
      "core": false,
      "reasoning": false
    },
    {
      "id": "i18n-expert",
      "path": "agents/i18n-expert.md",
      "category": "specialist",
      "status": "active",
      "core": false,
      "reasoning": false
    },
    {
      "id": "infra-planner",
      "path": "agents/infra-planner.md",
      "category": "backend",
      "status": "active",
      "core": false,
      "reasoning": true
    },
    {
      "id": "migrator",
      "path": "agents/migrator.md",
      "category": "specialist",
      "status": "active",
      "core": false,
      "reasoning": false
    },
    {
      "id": "perf-optimizer",
      "path": "agents/perf-optimizer.md",
      "category": "quality",
      "status": "active",
      "core": false,
      "reasoning": true
    },
    {
      "id": "planner",
      "path": "agents/planner.md",
      "category": "core",
      "status": "active",
      "core": true,
      "reasoning": true
    },
    {
      "id": "qa-tester",
      "path": "agents/qa-tester.md",
      "category": "quality",
      "status": "active",
      "core": false,
      "reasoning": true
    },
    {
      "id": "refactorer",
      "path": "agents/refactorer.md",
      "category": "specialist",
      "status": "active",
      "core": false,
      "reasoning": false
    },
    {
      "id": "scientist",
      "path": "agents/scientist.md",
      "category": "specialist",
      "status": "active",
      "core": false,
      "reasoning": true
    },
    {
      "id": "security-reviewer",
      "path": "agents/security-reviewer.md",
      "category": "quality",
      "status": "active",
      "core": false,
      "reasoning": true
    },
    {
      "id": "seo-expert",
      "path": "agents/seo-expert.md",
      "category": "specialist",
      "status": "active",
      "core": false,
      "reasoning": false
    },
    {
      "id": "style-expert",
      "path": "agents/style-expert.md",
      "category": "frontend",
      "status": "active",
      "core": false,
      "reasoning": false
    },
    {
      "id": "test-engineer",
      "path": "agents/test-engineer.md",
      "category": "quality",
      "status": "active",
      "core": false,
      "reasoning": false
    },
    {
      "id": "test-writer",
      "path": "agents/test-writer.md",
      "category": "quality",
      "status": "active",
      "core": false,
      "reasoning": false
    },
    {
      "id": "tracer",
      "path": "agents/tracer.md",
      "category": "quality",
      "status": "active",
      "core": false,
      "reasoning": true
    },
    {
      "id": "ui-engineer",
      "path": "agents/ui-engineer.md",
      "category": "frontend",
      "status": "active",
      "core": false,
      "reasoning": false
    },
    {
      "id": "ux-analyst",
      "path": "agents/ux-analyst.md",
      "category": "frontend",
      "status": "active",
      "core": false,
      "reasoning": true
    },
    {
      "id": "verifier",
      "path": "agents/verifier.md",
      "category": "quality",
      "status": "active",
      "core": true,
      "reasoning": true
    }
  ],
  "skills": [
    {
      "name": "ai-slop-cleaner",
      "path": "skills/ai-slop-cleaner/SKILL.md",
      "category": "quality",
      "status": "active",
      "core": false
    },
    {
      "name": "ask",
      "path": "skills/ask/SKILL.md",
      "category": "meta",
      "status": "active",
      "core": false
    },
    {
      "name": "autopilot",
      "path": "skills/autopilot/SKILL.md",
      "category": "execution",
      "status": "active",
      "core": true
    },
    {
      "name": "cancel",
      "path": "skills/cancel/SKILL.md",
      "category": "control",
      "status": "active",
      "core": true
    },
    {
      "name": "caveman",
      "path": "skills/caveman/SKILL.md",
      "category": "tooling",
      "status": "active",
      "core": false
    },
    {
      "name": "code-review",
      "path": "skills/code-review/SKILL.md",
      "category": "quality",
      "status": "active",
      "core": false
    },
    {
      "name": "critic",
      "path": "skills/critic/SKILL.md",
      "category": "quality",
      "status": "active",
      "core": true
    },
    {
      "name": "ctxcomp",
      "path": "skills/ctxcomp/SKILL.md",
      "category": "tooling",
      "status": "active",
      "core": false
    },
    {
      "name": "deep-dive",
      "path": "skills/deep-dive/SKILL.md",
      "category": "investigation",
      "status": "active",
      "core": false
    },
    {
      "name": "deep-interview",
      "path": "skills/deep-interview/SKILL.md",
      "category": "planning",
      "status": "active",
      "core": false
    },
    {
      "name": "deepinit",
      "path": "skills/deepinit/SKILL.md",
      "category": "meta",
      "status": "active",
      "core": false
    },
    {
      "name": "docker",
      "path": "skills/docker/SKILL.md",
      "category": "devops",
      "status": "active",
      "core": false
    },
    {
      "name": "doctor",
      "path": "skills/doctor/SKILL.md",
      "category": "meta",
      "status": "active",
      "core": true
    },
    {
      "name": "eco",
      "path": "skills/eco/SKILL.md",
      "category": "execution",
      "status": "active",
      "core": false
    },
    {
      "name": "emacs-integration",
      "path": "skills/emacs-integration/SKILL.md",
      "category": "tooling",